{
  "simulator_id": "dyngen",
  "request": {
    "profile": "scrna_grouped",
    "seed": 17,
    "effective_extras": ["groups", "lineage_tree", "tf_list"],
    "input_files": {},
    "params": {
      "backbone_template": "bifurcating",
      "num_cells": 10,
      "num_tfs": 3,
      "num_targets": 4,
      "num_hks": 2,
      "simulation_params": {
        "num_simulations": 2,
        "census_interval": 2.0,
        "compute_dimred": false,
        "compute_rna_velocity": false
      }
    }
  },
  "expect_progress": true,
  "required_files": [
    "expression.tsv",
    "extras/groups.tsv",
    "extras/lineage_tree.tsv",
    "extras/tf_list.txt",
    "truth/global_network.csv",
    "truth/legacy/global_gs.csv",
    "truth/group_networks",
    "simulator-output-manifest.json",
    "progress.json",
    "provenance/raw/model.rds",
    "provenance/raw/dataset.rds",
    "provenance/raw/group_networks_index.tsv",
    "provenance/raw/group_edge_activity.tsv",
    "provenance/raw/group_active_networks.tsv",
    "provenance/raw/lineage_states_used.tsv",
    "provenance/raw/lineage_transitions_used.tsv"
  ]
}
