{
  "simulator_id": "dyngen",
  "request": {
    "profile": "scrna_grouped",
    "seed": 13,
    "effective_extras": ["groups"],
    "input_files": {},
    "params": {
      "backbone_template": "bifurcating",
      "num_cells": 10,
      "num_tfs": 3,
      "num_targets": 4,
      "num_hks": 2,
      "distance_metric": "pearson",
      "simulation_params": {
        "compute_dimred": false
      },
      "experiment_params": {
        "map_reference_cpm": false,
        "map_reference_ls": false
      }
    }
  },
  "expect_progress": true,
  "required_files": [
    "expression.tsv",
    "extras/groups.tsv",
    "truth/global_network.csv",
    "truth/legacy/global_gs.csv",
    "simulator-output-manifest.json",
    "progress.json",
    "provenance/raw/model.rds",
    "provenance/raw/dataset.rds"
  ]
}
